{
  "round": 1,
  "position": "PARTIAL",
  "blocking_responses": [
    {
      "concern_id": "B1",
      "disposition": "ACCEPT",
      "reason": "The count included archived rows; the claim now cites the filtered export."
    },
    {
      "concern_id": "B2",
      "disposition": "CLARIFY",
      "reason": "The secrets store was out of scope; a scope claim now says so."
    }
  ],
  "new_points": [
    {
      "id": "R1",
      "text": "The scope claim now lists the secrets store as excluded."
    }
  ],
  "requesting": "RE-REVIEW",
  "packet_digest": "5555555555555555555555555555555555555555555555555555555555555555"
}
