{
  "round": 2,
  "position": "AGREE",
  "blocking_responses": [
    {
      "concern_id": "B2",
      "disposition": "ACCEPT",
      "reason": "Agreed: a due date does not show the key was never rotated early. A new unverified claim states rotation history as a gap."
    },
    {
      "concern_id": "B4",
      "disposition": "ACCEPT",
      "reason": "The recommendation now says to confirm rotation status first."
    }
  ],
  "new_points": [],
  "requesting": "RE-REVIEW",
  "packet_digest": "69912a33b91d95f477359ef5b942091330410da5f65933787ba516736142ab05"
}
